video_number,date,extracted_text,creators
80,"Nov 3, 2022","hubby and I booked a cheap motel down in the city to meat with my bull boyfriend @hot2malii . He came over and I flaunted his huge black cock on the couch as hubby watched and stroked himself. I tried to take all of him in my mouth but I was chokking and gagging on it. He was extra hard as I usually can take him with ease. I started to ride him but instantly was creaming out of my pussy and it dripped down his balls and shaft. Hubby came over and started playing with my tight little ass and dirty talking how badly he wanted to fuck me in my ass while I was stuffed by my bull. I ended up getting fucked doggystyle while he laid on the ground jerking off and mounted his lips with my pussy so he could taste how freshly used I was and jiggled my lips all over his. We moved to the bedroom and while I was taking it deep, hubby spread my ass and pushed me back and forth on my bulls cock while I rubbed my clit to orgasm. He was massaging me, scratching my back, and I could feel his precut leaking all over me. It was so intimate we told each other we loved one another right after I told him how much I loved big black cock fucking me. He whispered in my ear how bad he wanted my bull to cum inside me, and I agreed I wanted it so bad. After getting a thick load all over my ass it was time for reclaiming. I think this was the fastest hes ever cum. What ended up happening is, he was going in and out but he felt my bulls cum drip down my ass into my pussy and it became his lube that he was fucking inside of me. The dirtiness of him made pull out and cum instantly. I hope you like this one its super intimate. I have a lot more of these home videos to share with you <3 CREATORS:",
81,"Nov 7, 2022","We locked our cucks in chastity and rode their face as we sucked on our bull's huge cocks. After smothering them, til they were almost out of breath we mounted and rode side by side while our hubbies gripped our asses and pushed us up and down on every inch. They got a bit too turned on and started licking the edges of our assholes with their cocks in they faces. We ordered them to the ground and made them get under us as we got fucked doggystyle, commanded them to stare at the big cocks going in and out in and out. Finally @hot2malii came all inside and over @aurora_aspens pussy and her cuck was made to lick up every single last drop. I let my cuck out of chastity after orgasming with my Hitachi on @louisfarels cock and they were luckily enough to be able to reclaim us... however short it was they lasted! I hope you enjoy this <3 CREATORS: @aurora_aspen, @louisfarel","AURORA ASPEN, LOUIS FAREL"
82,"Nov 17, 2022"," hosted my first ever orgy of the summer with some of my favorite hotwives, swingers, and bulls Ive met online and through the lifestyle. @louisfarel @tribalbbc @nickeyhuntsman @iamkatemarley @saylervixen @hot2malii. This whole thing kind of came together by luck. I had been talking to @saylervixen about getting together to play with a bull after her trip to New York and simultaneously I was talking to Kate & Chris Marley about filming some content together and they were free the same weekend Sayler was and I asked each of them if theyd be interested in all meeting up and playing together. They said hell yah and they loved group stuff. Coincidentally @tribalbbc texted me saying he wanted to do an orgy and I mentioned that I was talking with everyone else and he said Im in! @hotm2alii and @louisfarel were free as well. I ended up booking a huge house that everyone who flew in from out of state could stay at, hang out, mingle, and sleep so it was super convenient. It was a lot of coordination and effort and we had a few people bail out for the 8th person but last minute @iamkately introduced us to @nickeyhuntsman who said she was down ! I was really nervous doing this, Ive never been in a group setting like this, never hosted a group of people, and wanted to make sure everyone got along, there was chemistry, and the logistics of planning came together without any hitches. Everything went amazing! We all hit it off, swam in the pool, made drinks together, had amazing conversation, and the orgy just naturally started flowing. For over an hour we all switched positions and fucked one another next to each other, on top of each other, in-between each other, and more. It was an awesome blend of experienced swingers, first timers, hotwives, cuckold aspects, and all of my favorite things in one mixed together. My husband and @saylervixen filmed the entire thing and got to watch while we all had fun. After everyone was exhausted and fucked out, @saylervixen let her husband reclaim her pussy and clean her up as she dirty talked to him the entire time. This was a lot of effort from fantasy, to coordination, to finishing and editing it so I really hope you guys enjoy it. All your support has been amazing so far and lets me live out my fantasies and do crazier and crazier things! Let me know your thoughts ! I want to and am going to plan another one so itd be interesting to see who you think would be a good fit to add to open to any all suggestions - you know my type! CREATORS: @louisfarel, @tribalbbc, @nickeyhuntsman, @iamkatemarley, @saylervixen","LOUIS FAREL, TRIBALBBC, NICKEY HUNTSMAN, KATE MARLEY, SAYLER VIXEN"
83,"Nov 17, 2022","I'll be doing a MFM this weekend with two bbc bulls. Can't wait to get double stuffed. I've been busy filming and haven't been on as top of my messages as I normally am so I wanted to release the video a few hours early for ya'll! I went out with a date with my bull boyfriend and made hubby drive me so I could have a few drinks. He waited in the car while we had appetizers, entrees, and desert and did a walk around the promenade shopping. I wanted to make him my chauffeur for the night and I thought it'd be hot to have him wait in the parking with the car throughout the whole dinner. When we were finished, I summoned him like an uber and made him drive us to our hotel. I was in the backseat and I was dripping wet with my bulls hands between my legs and I could feel his cock getting hard. We started kissing and I couldn't wait another 15 minutes until we got to the hotel so I had him pull off a desert back road so I could cum really quick. I ended up sucking his cock on the dirty road before he bent me over and then I started riding him in the car. My husband started jerking his dick off watching me in the back seat. My bull pulled out a HUGE thick cum load all over my ass and it dripped down onto my pussy and onto the floor of the car. Hubby fingered me with his cum before he fucked me for about 20 seconds and came all over my ass and pussy as well. We cleaned up a little and he drove us to the hotel for round 2 :) I'll be sharing that soon <3 I hope you enjoy and have an amazing weekend I'll send updates from my MFM! CREATORS:",
84,"Nov 24, 2022","happy thanksgiving! I give thanks to all the big dicks in my life and for my loyal cuck who lets me enjoy them whenever I please ;) here's my latest video. I had some guests staying over the house sleeping in the guest room, but I was super horny and needed to figure out a way to fuck @louisfarel. I told my cuck who was locked in chastity to wait in the garage until the coast was clear, and I snuck @louisfarel in through the door. He opened the door and my obedient cuck was in there, locked up, a bit confused, but ultimately knew what was going down. I ended up comparing my bulls huge cock hand in hand with a small caged cock in chastity to see the size difference. I even rubbed them together for an extra tease. For the next Half hour, he had to sit there locked up watching me cum all over a big thick cock. It was so hot knowing there were guests in the house who could walk in at any time and catch us doing our dirty like secret life in action. I had to be a little quiet to not raise any suspicion, but it can be hard when getting fucked hard. I hope you have an amazing holiday with friends and family. I'll be getting stuffed this weekend ;)2 CREATORS: @louisfarel",LOUIS FAREL
85,"Dec 2, 2022","@saylervixen and I have become super good friends and her and her husband love to come out and visit me to play with some of my hung friends! I found out recently that she's super submissive so I leashed and collared her and walked her around the floor and presented her to @louisfarel who was standing in the bedroom rock hard. We tied her cuck husband up prior to this so he was strapped into his chair and could only lightly play with his cock. After I made her g4g and worship his beautiful big white cock, I walked her over to the bed and she mounted her bull while I pulled on her leash. We both talked dirty to her cuck and humiliated him while he was strapped in and helpless. I felt bad for him, (not really), so I walked her on her leash over to him and she ended up getting fucked while he had to kiss her and feel her elevated heart rate while taking a big thick cock. She teased him a little more and grinned her stretched pussy all over his little dick while she teased and sucked his cock before finishing him off with a thick cum load. I love playing with @saylervixen and I can't wait to femdom her more and introduce her to some bigger and bigger cocks and more dominant men. CREATORS: @saylervixen, @louisfarel","SAYLER VIXEN, LOUIS FAREL"
86,"Dec 11, 2022",over the summer when @aurora_aspen and @emmariley came to hang out with me for a week. The power of three dominant goddesses was no match for these two unlucky subs. We tied them to the spanking benches and each had our way with them. @emmariley strolled around with her whip and spanked each on while we penetrated them with our strap ons. Emma even mounted each of us for a human centipede for some girl on girl fun. Afterwards @aurora_aspens boyfriend needed a little extra punishment so Emma pegged him while Aurora rode his face and I took pictures mocking and humiliating him to make sure he never forgot this moment! CREATORS: @aurora_aspen,AURORA ASPEN
88,"Dec 16, 2022",@emmas_secretlife and I were having a fun couples weekend with our hubbies and were craving some big black cock. We went out and met with @hot2malii and @tribalbbc and went back the house together. This was her first ever foursome and two bbbs at once. We got roughly fucked next to each other in every position. At a certain point I had to tap out and leave the party to relax with @hot2malii in the jacuzzi before heading back in. Emma was such a little slut as she got a cumload all over her ass and pussy that I licked up and then she took a second cumload and got creampied by @tribalbbc. I love hanging with her so much fun and she has such a nice body and ass. Maybe next time we will throw a bigger party! CREATORS: @tribalbbc,TRIBALBBC
89,"Dec 21, 2022",I invited my bull over to come fuck me in our bed we sleep in together. Lots of close up before he cums all over my ass :) let me know once you've cum to this https://onlyfans.com/477233663/neversatisfiedxo CREATORS:,
90,"Dec 24, 2022","how was your Xmas eve ? I hope it was spent with loved ones and lots of great food. I wanted to share with you a very intimate and passionate threesome with my bull boyfriend @hot2malii and my cuck husband. We were hanging out watching tv bored and I was horny so I started sucking his bbc as my hubby mounted me from behind and slowly warmed my wet pussy up. Afterwards I mounted my boyfriend and rode his thick long cock as hubby held and embraced me and we kissed eachother telling we loved one another. He was rubbing my cock as I bounced up and down and squeezed my inner thighs and abdomen. I started taking him deep doggystyle as my cuck lay under me close to the action, hearing the thrusting and feeling my drippings all over his face. I let a huge screaming orgasm out, and then rode his face as my body was flush and shaking. My boyfriend still hadnt finished as he has such long stamina that he fucked me deep missionary before pulling out all over my pussy and then I rubbed in his cum. Although hubby got to initially mount me, I denied him an orgasm and was the only one not to cum! CREATORS:",
91,"Dec 29, 2022","the new year is almost here. I dragged @louisfarel out into the desert on a backroad blind folded and told him I had a surprise. We went around 6 miles off road and came across a donkey that started head bashing our car - so we drove off quickly, leaving a trail of dust in our rear view. Once we got down to the wash, I made him hike naked over a mile up a steep incline to a spot that I thought would be perfect to destroy his ass hole at. It had equal lake view and Mountain Views. There was a camp nearby and we could hear everyone just on the other side of the cliff. I proceeded to fuck him out in the open as sunset happened happened over the lake. Afterwards we drove back onto a different backroad and I made him jerk off and eat his own cum in the pitch dark. Hubby and I used to go hiking all the time in nature and I'd pack my strap in our camelback or hiking backpack and I'd fuck him over beautiful sceneries. I love adding new subs to the mix now :) CREATORS: @louisfarel",LOUIS FAREL
92,"Jan 6, 2023","it had been a year or so since I had seen @chrishasabig. We met him in an upscale downtown hotel and it was so nice to catch up and see how everything was. I never forgot how big and thick his cock was, and I was wet in anticipation until I get to put my hands and mouth all over it. I wore a new pair of black lingerie that I thought he'd appreciate and I got on my knees near the door and started sucking his cock in front of my husband. After gagging on it, he led me down to my knees on the floor and started fucking me. It took a while to adjust to his size. I walked him to the bed and stroked his cock before riding him and fucking him hard bouncing on top of it. My husband said his dark thick cock looked so good in my tight pale pussy, and he wanted to lick my ass also bad and wished there was another BBC there to double penetrate me. I then got fucked doggy while he pulled my hair. It was so rough my eyes rolled to the back of my head. Lastly he pumped me on the bed before pulling out all over my pussy and ass and I laid their exhausted, rubbing it in. The following night we had a MFM threesome with another BBC and it was such a great weekend. Looking forward to hanging with chris more :) CREATORS: @chrishasabig",CHRISHASABIG
93,"Jan 14, 2023"," @saylervixen is one of my best hotwife friends and we both have an insatiable appetite for big dicked bulls to fuck us in front of our husbands. We had a nice couples night at our house and before long @louisfarel and @hot2malii came over. After a few glasses of wine we all went into my bedroom and we started sucking their huge cocks. @saylervixen s husband is always so turned on that he touches himself while he records on his phone. We got fucked in every position, riding, switching back and forth, deep in doggystyle, and on our backs. @hot2malii cock was looking extra huge as he fucked Sayler's tight asian pussy and pulled out and came all over her mouth at the same time @louisfarel came all over my ass., we hugged, kissed, and professed our sisterly love for one another. we are planning a week to get together soon <3 can't wait !!! CREATORS: @saylervixen, @louisfarel","SAYLER VIXEN, LOUIS FAREL"
94,"Jan 24, 2023","My husband and I watched videos of @mrsjones011 taking BBC online a few years ago and came so hard masturbating to her BBC adventures. In passing, we saw that she had a twitter and just started an OnlyFans and was back online sharing content so we started chatting. We realized quickly we had a lot in common - both of us had a BBC boyfriend that we saw regularly and cuckold our husbands with! They had some free time from work and flew out to come hang for a weekend! I introduced her to @hotm2alii and we both started caressing her body all over as he ate her pussy out and got her warmed up for a stretching with his big cock. She let out a breathy moan as soon as it went in and I could tell instantly this was going to be a hot night. We ended up fucking all around the hotel room, and I rubbed her clit and slapped her ass to help her cum. I could tell just how much of a BBC slut she was and I was so turned on. I then started riding @hotm2alii while she rubbed my ass. We went into doggystyle position and laid on top of another - and we instantly grew close as he started going back and forth between our dripping wet pussies. Her cuck husband was hard stroking his dick while holding the iPhone. She started squirting everywhere as he fucked her deep and hard before finally letting out a deep creampie blasting his seed deep into her belly. Her cuckold husband was just about to cum before she made him stop, get underneath her, and clean out every last drop with his tongue and fingers. It was such a memorable night and I knew the rest of the weekend was going to be a lot of fun! We went out and had some dinner shortly after before hanging out back at their hotel room sharing our hotwife escapade stories! The following night we did a MFFM BBC 4some which I can't wait to share with you too! Go give @mrsjones011 a follow - she is super hot and living the lifestyle :) CREATORS: @mrsjones011, @hotm2alii","MRS JONES, HOTM2ALII"
95,"Jan 29, 2023","I saw that Top G Andrew Gape was arrested last week after exposing his location to authorities after ordering pizza from a local spot. Behind the Top G's ""alpha male"" facade, which is a character to sell some courses to insecure men, is a true bottom bitch. I needed to expose this side of him to the world by spanking, throat fucking, p3gging, cucking, and making him eat his own cum. There's no reason to present yourself to the world as anything other than your truest form. I hope you enjoy this as I had fun making this a few days ago with my husband, my boyfriend @hot2malii, and my sub @louisfarel. Video here: https://onlyfans.com/504723557/neversatisfiedxo CREATORS: @louisfarel",LOUIS FAREL
96,"Jan 31, 2023","This sub follower was quite insistent on living out his BBC cuckold and f0rced bi fantasies and he was willing to go to extreme lengths in order to satisfy the itch festering in his head. Porn just wasn't enough. I'm not sure if he was a trust fund baby, sold a company, or came into a pile of cash - but as the old saying goes ""money talks"". He coordinated his travel, had to check in with security, placed his phone in a bag, and was blindfolded until I walked him over to @louisfarel BWC and teased him, denied him, and finally pressed his open mouth until they touched the warm flesh of a big cock - while he sat there in his panties and chastity. The ultimate service for a mistress. After making fun of his cock, kicking his chastity cage, I invited @hotm2alii in and @louisfarel held him back on his collared leash while he sat there watching me suck a big black cock. I saw out of the corner of my eye he was engored in his cage. I summoned him closer and closer to really see the length and size and superiority of my bulls cock versus his before I shoved his face into my pussy lips and he licked while I rode up and down - tasting my juices and brushing his tongue against the thrusting cock. I wanted to take @hot2malii deep doggystyle, so I made him get on the floor at a place I called ""cucks lookout"" where he lay facing the sealing staring into my pussy as it was stretched a.k.a. the splash zone. After receiving cum all over my pussy and ass - the sub helped clean every sperm cell out of my pussy. How useful helping me avoid pregnancy. I laughed, put a mouth dildo on him, and he got to fuck my pussy with his face while on his knees over a glass table. CREATORS: @louisfarel, @hotm2alii, @hot2malii","LOUIS FAREL, HOTM2ALII"
97,"Feb 9, 2023",@emmariley visited me a lot last summer and I introduced her to @hot2malii and @louisfarel as her cuck husband was back home working and paying the bills for her while she was out fucking guys and having the time of her life and sending pictures videos and updates for him to jerk off to. We got really turned on by the thought of two huge dicks rubbing against one another with oil - so we did frontage with two bull cocks to get every one warmed up and build chemistry. I started to suck their cocks with a double barrel blowjob while @emmariley rubbed and caressed their bodies. We moved to the couch and switched off between riding and doggy before @hot2malii lifted me up with his strong arms and pounded me in the standing position. We made our way to the bedroom and Emma I have such a strong bond that we wanted to lay on top of one another chest to chest while we got spitorasted in our mouths and pussies and the guys switchd back and forth between us. I used my magic wand to cum to orgasm and then we flipped over and laid on top of one another as they continued to go back and forth. Emma started to squirt while @hot2malii was fingering her and we both took their dicks all their into our bellies before finally they came all over our stomaches and we all kissed and showered together <3 im excited for Emma to come visit me this year :) CREATORS: @louisfarel,LOUIS FAREL
98,"Feb 13, 2023","@iamkatemarley hung out at our house for a few days after our orgy weekend over the summer. we had shared that although we had a lot of experience in hotwife mfm situations we were still pretty new to exploring swinging with couples and the most we had done was same room sex. we had all hit it off and after some time by oaur pool and a few drinks we decided to take the dive and try out our first swap experience. I had a little twist in mind though. Instead of normal vanilla sex.... I'd wear a strap on and fuck my husband in the ass while he was fucking Kate Marley and I was getting fucked at the same time! We started with some frontage cock rubbing that led to a double barrel blowjob as I rode my husbands face. We then moved to sex and he started fucking Kate and it was the first time I'd ever seen him fuck another girl, I started to stick my strap on in his ass and then chris got behind me. My husband ended up creampieing Kate after being penetrated deep and having an anal orgasm at the same time. It was so hot ! We have some plans to hang out again soon :) CREATORS: @iamkatemarley",KATE MARLEY
99,"Feb 16, 2023","I had a new submissive @bunnybuttstuff reach out to expressing her interesting in serving me and exploring her dirtiest fantasies. she's in a daddy / babygirl relationship with a Dom and she is locked in female chastity, has to check in every morning to confirm she has a plug, and does whatever her superior says. She told me she's never had BBC before or a big cock in her ass, and I let her know that if she made the flight out my way, I'd show her a good time. I locked her in her female chastity, blocking her pussy from any cock, and locked my husband up in his chastity cage as well and dressed him up with a big strap on. We made fun of hubbies locked little dick in front of my bulls monster cock and then bunny showed off for us. I made her suck on a big black cock and get facefucked while I put a thick glass wand in her ass. I made her taste the wand after she had been fucked in the ass with. I wanted to cuck both of them and had bunny get on her knees and suck my bulls balls while my juices got in her face. My husband mounted her from behind with his strap on and started warming and stretching her up for her first big black cock in her ass. We moved to the bed and I got fucked deep in doggystyle to show bunny what she was about to get. My bulls cock went in her ass surprisingly easily. She had been wearing a huge plug all day. He fucked her deep while I spanked her cheeks until they were red. Afterwards she got underneath me in the cuckold fucklicking position while I squirted in her ass before my bull cums deep in her mouth. We ended up playing a few more days and planning her next visit early March where she will serve me again and get her limits pushed. CREATORS:",
100,"Feb 21, 2023",wow! I can't believe I've released 100 videos at this point. In honor of it here's a free video for you :) . I threw a little Super Bowl party with my husband and boyfriend and I got horny during the game thinking about getting gang banged by both teams in the locker room. I locked my husband in chastity before my boyfriend came over and made him make us appetizers and bbq for us in the back yard. I told them both to take off their pants and I started to suck his bbc and ride him while my husband sat back and watched. I'm sure it was distracting for him and I missed most of the game - but he got to watch his two favorite things.. football and his wife getting blakked all at once. I hope you enjoy this one ! You can be rest assured there is going to be tons of content this year. I've already got close to another 100 videos stored up on my hard drive I'll be editing and releasing and have been planning some amazing play dates over the next six months in different parts of the country. Thanks for supporting us and watching our videos <3 LINK HERE TO WATCH: https://onlyfans.com/523919145/neversatisfiedxo CREATORS:,
101,"Feb 27, 2023","video with @mrsjones011 . We invited @hot2mali and @realtalk88 over to have some fun with their big black cocks. We fucked them both in so many different positions putting on a show for our guys. Afterwards, her cuck husband cleaned up her creampie filled pussy and then I let teased him a little and let him try cleaning out the cum out of my pussy while his wife watched. I think he got to live out his cuck fantasies this night <3 @mrsjones011 and I are going on a beach couples vacation this spring and of course we will be fucking lots of black guys <3 CREATORS: @mrsjones011, @realtalk88","MRS JONES, 88ONFLEEK"
