video_number,date,extracted_text,creators
103,"Mar 17, 2023",@emmariley and I took @aurora_aspen and her cuck into a dungeon and made him submissive to three femdom goddesses and a BBC bull @hot2malii CREATORS: @aurora_aspen,AURORA ASPEN
104,"Mar 23, 2023","last weekend where my pussy got destroyed and passed back and forth between a huge black cock and a huge white cock bull in front of my husband. After I choked on each of their cocks while getting rammed in doggystyle, missionary, and then them cumming all over my pussy making a mess.... I humiliated my husbands small cock in front of them and I let him reclaim me with one caveat, he had to wear an oversized magnum condom. Is that even considered reclaiming if you can't even fuck your wife raw while her bulls can? I'm not sure.. let me know your thoughts on it. He came so fast and had to beg me to allow him to fuck and he filled up the condom all the way as he had been locked up for a few days prior. All in all - a great night <3. CREATORS:",
105,"Apr 16, 2023",I invited my boyfriend over to come breed me on the couch one night in the living room. My cuck supported me and lifted my head while I sucked his big black cock. He then started stroking in and jerking as he watched me ride him and fuck him doggystyle before he cums all over my ass and pussy. I started to make fun of my husbands dick as he slid in since it felt like a light tickle and he quickly came. I was dissatisfied with the fucking so I pulled away since I had been over it since it began. New vids on the way! CREATORS:,
106,"Apr 24, 2023","I hung out with @bunnybuttstuff before she went anal only last year, and gave her her first DOUBLE PENETRATION experience. I l0cked her up in female chastity and teased her locked pussy with the Hitachi grinding against the medal. I then turned her around and flogged her pale little tight ass before putting a glass plug in. As soon as she was warmed up and whimpering, she rode Hot2Maliis BBC for the first time. Afterwards @louisfarel squatted down and started fucking her ass. She took it a little too easily! I guess those big plugs she's been training with really work. I was in awe. Afterwards @hot2malii laid her on her back and fucked her missionary with holding onto her feet and came on top of her pussy. @louisfarel fucked her while I Ch0cked her and sl4pp3d her face til she came down all of his BWC before he unloaded a creampie. It's so fun to Dom her. :) CREATORS: @bunnybuttstuff, @louisfarel","BUNNYBUTTSTUFF, LOUIS FAREL"
107,"Apr 30, 2023"," went on a vacation with my husband, @mrsjones011, and her husband to the beach for some hotwife vacation fun. my bull boyfriend @hot2malii flew in and stayed with us and he fucked @mrsjones011 almost every night. After having some drinks and tanning by the ocean, we went back the room and I started to rub oil all over @hot2maliis body while @mrsjones011 used her vibrator. She started sucking his big black cock and then I mounted him while she caressed my body. We fucked him in every position and watched each other while he stretched us out. He came deep in @mrsjoens011 and her hubby was in the mood for some dessert and passionately cleaned up every last drop. Vacations with hotwife and cuckold couples are always the most fun! CREATORS: @mrsjones011",MRS JONES
108,"May 10, 2023","vacation is my favorite time. I get to get away from the mundane and the routine and be pampered like a queen by my husband. He wanted to surprise me with a bunch of things, but I ended up just fucking @hot2malii and @renecharles the whole time was I sucked their huge black cocks before being spitorasted and pounded. I'm ready for three at once now, and it looks like it's going down so I can't wait to share it with you. CREATORS:",
109,"May 30, 2023","@louisfarel auditioned for my circus freak show and gets flogged before I make him suck my strap on and bend him over to peg him hard. He mounts me as I grab his throat and pinch his nipples as he bounces up and down. I locked him in a cage, and in his final performance, he fucks himself on my dildo through the head hole with quite the athletic reverse pull up. A buttslutt will do anything to be stuffed. I make him eat his own cum before sending him on his way. I think he's hired. CREATORS: @louisfarel",LOUIS FAREL
110,"Jun 12, 2023","a BBC G4NG BAANG ! When my husband asked me to talk about all my fantasies initially, I told him I was wanted to have multiple hung black men with big cocks using my mouth and pussy. His jaw dropped but he was turned on by it because he started dirty talking in my ear that night about the fantasy which made me cum so hard all over his average sized cock! Whenever I'd Pegg him or milk his prostate I'd whisper it in in his ear as well and he'd explode all over so fast. Anyways, it finally happened. We arranged it on vacation and I had three of the hugest cocks from @hot2malii @bruce_wang00 and @nrjranman63 . Needless to say .. I'm addicted and I can't wait to do it again <3 CREATORS: @bruce_wang00",BRUCE WANG
111,"Jun 16, 2023","we had a threesome in the guest room and hubby got to have me for about 30 seconds before he jacked off. he was meant to reclaim me, but ended up premature ejaculating all over myself and the bed (I made him do the laundry after). My favorite thing is when he spreads open my pussy lips and rubs my clit as I'm taking a big cock! It's so hot to have your body caressed by someone while you are cumming on someone else. hope you cum a lot to this this weekend https://onlyfans.com/633473617/neversatisfiedxo CREATORS:",
112,"Jul 8, 2023","I threw a big dick bull party for @aurora_aspen and @emmariley. I sent out +1s thinking they'd maybe bring a hung bull, but @aurora_aspen s tag along cuck thought he was invited and was going to get to have sex. He couldn't be more wrong. He stayed locked up, watched, and could only taste the wet juices from our pussies. He tried to begh to lick my ass and was denied because I didn't want his worm tongue on me. He got to taste two thick bull loads (it sounds like he's getting more creampies then pussies at this point). @lousiarelx @hot2malii CREATORS: @aurora_aspen",AURORA ASPEN
113,"Jul 14, 2023","In the spring, @mrsjones011 went on a hotwife vacation to Florida with our cuck hubbies. We had @hotm2alii stay in the room and fuck as all vacation after laying out on the beach, going in the pool, going out drinking. Everyone, everywhere knew we were cucking our husbands and we were all so turned on. Teasing them with another man while in our bathing suits and feeling his bulge through his pants. I loved being in the elevator flirting with him while we ignored our cucks before we'd go back and fuck. We started off massaging him after his long flight with oil, caressing his ass checks and flipping him over to stroke his big black cock. @mrsjones011 has the tightest body of any hotwife I've met and I started using the Hitachi on her clit as she rode him. I had my turn with my legs in the air while getting deeply penetrated as @mrsjoens011 touched me and watched me while she masturbated. She then got her throat grabbed while I rubbed his body all overs. After getting a deep creampie, her cuck hubby was humiliated a little before slurping all of his cum as an appetizer before we had a dinner afterwards and went out dancing. So fun. Hotwife vacations beat any other ones I've been on with friends or family. CREATORS: @mrsjones011",MRS JONES
114,"Jul 18, 2023","with @bunnybuttstuff . She always visits me with her ass plugged with a huge glass buttplug and her chastity cage on. I love having a female sub. She'll do whatever I say. And since her pussy is off limits, I make sure sure her ass gets properly stuffed by my big dick friends @hot2malii and @louisfarel. This time we all went into her princess bedroom with her Teddy bears and we started to worship both of their big cocks together. I started riding a BBC while her BWC started to fuck her ass. It was time for her to take a big black cock in her ass and she was fucked til she couldn't take anymore. Her legs were squirming so she rode and humped her giant teddy bears. @hotmalii cums in her ass while I spread it open and @lousifarel licks it out like the dirty slut he also is. I'm always surprised how much she can fit in there and for how long. I guess that crossfit builds up her endurance! CREATORS: @louisfarel",LOUIS FAREL
115,"Jul 20, 2023","I was recently on an East Coast trip that I had been coordinating with the amazingly beautiful @jezebelscarlet who traveled across the pond from London to meat me after we had been talking for months! I wanted to show her an amazing time stateside and so I put together a BBC orgy with @bruce_wang00 @njranman63 and @hot2malii and invited my dear from @mulberry212. We had an amazing time hanging in our flat, having a few drinks, getting loose up, and finally after we were all so horny made our ways to the bed where we all got fucked super hard! What an amazing memory. I'll let the video speak for itself. Should I host more of these? CREATORS: @jezebelscarlet, @bruce_wang00, @mulberry212","JEZEBEL SCARLET, BRUCE WANG, MULBERRY"
116,"Jul 28, 2023","It's been a while since @emmariley and I had played together. A little back story, she's one of my oldest hotwife friends and we used to like a few streets away from one another. We'd always go out and flirt with guys while our partners would hang out and we'd share the escapades with them. It's pretty cool they both could be open about being cucks together. We ended up moving away, but she'd always come and visit me while her cuck stayed home and we'd always find some BBCs to fuck together. We were having a fun pool day and we both got really hungry afterwards so we invited over @tribalbbc and @hot2malii and to fuck us all over the kitchen and in the bedroom before going back out to the pool. We took their huge cocks doggystyle, missionary, and rode each others faces with their cum. I LOVE hanging out with her because she's just as dirty as me, and she loves that her husband gets to see the videos at the same time as all of you for the first time. CREATORS: @tribalbbc",TRIBALBBC
117,"Aug 4, 2023"," It was a long time coming but I finally got to see petite BBC slut @littlemouchette and get fucked by two big black cocks with her in front of our cucks. @hot2malii and @bruce_wang00 had their cocks worshipped by u before we started mounting and riding them. The thing I love most about @littlemouchette is that shes as big of a BBC slut as they come, just like me. @hot2malii cums all over her ass and her cuck who had been locked up in the corner, came in first his first (not last) of creampies off her ass. @bruce_wang00 started focusing on Couchette while I femdommed her. Shes such a good little submissive girl getting choked and fucked hard. I teased her cuck with my feet and blew my e-cig in his face and laughed and spanked him until @littlemocuhette got her second creampie of the night which I rubbed his face in until she was licked clean as we mocked him. It was such a good time. Should we hang again? CREATORS: @littlemouchette, @hot2malii, @bruce_wang00","LITTLE MOUCHETTE, HOT2MALII, BRUCE WANG"
119,"Aug 18, 2023","I got to see the beautiful London hotwife @jezebelscarlet on a trip we planned to the east coast together over the last few months. Our cucks got quite a show the whole vacation! We fuck @hot2malii and @bruce_wang00 in almost every position while they sat back and jerked their little dicks. We became great friends and will be cucking our hubbies in Europe next ;) CREATORS: @jezebelscarlet, @bruce_wang00","JEZEBEL SCARLET, BRUCE WANG"
121,"Aug 26, 2023","I hung out with this hot swinger couple @liamgetsit and threw a sexy orgy 5some in their hotel room bed. @liamgetsit got to explore sucking and fucking her first big black cock @hot2malii while we rode @louisfarel side by side. as. Watch us girls handle 3 massive cocks and love every minute of being fucked and stretched out. You'll see group play, spitroasting, pussy eating, double BJs  and cum licked off her ass  CREATORS: @liamgetsit, @louisfarel","LIAMGETSIT, LOUIS FAREL"
122,"Sep 1, 2023","A longtime loyal generous fan expressed it was his biggest fantasy to be femdommed and cucked by a BBC while locked in chastity but he couldn't find a girlfriend who he thought would be accepting of his kinks or be open to having sex with another man in front of him. After developing a relationship and passing all of the verification requirements we met up in a hotel and I locked his little cock up in chastity and made him watch me get fucked in every position as I leashed him and pulled him in close. He had to service me by using the Hitachi on my pussy and getting me extra wet since I was feeling tight. After my I came, my BBC boyfriend pulled out all over my pussy. Instead of letting him clean me up right away, I let my husband fuck me with my bulls cum as lube and afterwards he had to suck and lick the reclaimed cum off my husbands cock. This was a first for my husband and part of his progression to do naughtier and dirtier things. Last but not least, he was a good boy, so I let him lick the remaining cum off my pussy before sending him on his way to jerk off to the memories for the rest of his life. CREATORS:",
123,"Sep 8, 2023",I linked with @mrthiccbbc in a hotel room with my husband. He was so muscular and fit and had the thickest cock. He fucked me in every position super hard with his athletic stamina. I hope you enjoy <3 over 1hr20m of footage CREATORS: @mrthiccbbc,MR. THICC BBC
124,"Sep 11, 2023",enjoy! Click here to watch https://onlyfans.com/729899905/neversatisfiedxo CREATORS:,
125,"Sep 15, 2023",Here's a new video for you to jerk off to all weekend. I hung out with @chrishasabig and @hot2malii and they both have some of the biggest cocks I've fucked. I worship them both back and forth with my mouth on my knees before I ride Chris and suck off my boyfriend. They both take turns passing me back and forth and spitorasting me until I got my pussy and ass covered with their cum. I was so stretched out at this point I couldn't even feel hubbies little dick as he reclaimed me and right as he was about to cum all over me I pull away and he has to cum all over the bed. My pussy and ass are reserved for BBC cum cuck. CREATORS: @chrishasabig,CHRISHASABIG
126,"Sep 21, 2023"," I've been controlling the chastity cage of my little submissive anal only slut @bunnybuttstuff so much lately. I love to leash her, block her pussy, and tell her all the sexual things she needs to do in order to please mommy. Her first order of business was to suck and deep throat @hot2malii big black cock and @louisfarel big white cock as I tugged on her leash and push them down her throat. I loved when she puts both in her mouth. After I deemed that she pleased them enough - I made her get on her knees and watch me fuck a big black cock while she licked on my ass and his balls. She wasn't getting any in her pussy since she was locked in her chastity belt but I know she wanted to feel it! I made her get under me as my boyfriends big black cock went back and forth between fucking my pussy as she worshipped my clit and sticking it in her mouth and g4gging on it. Next up I made her take out her thick plug that she wears 24/7 and overnight and get her asshole nice and loose and ready to get fucked in the ass. She gets pounded by a huge black cock before taking a back to back facial. What a good little girl. I think I'll keep her locked up forever. CREATORS: @louisfarel",LOUIS FAREL
127,"Sep 27, 2023",This new video I think you'll love! I lock my husband in chastity and threw the key across the room after comparing and humiliating his small shrimp cock to my boyfriends big beautiful black cock. I made hubby wear a plug with extra lube to loosen him up. I put a plug in as well and my boyfriend fucked me deep in doggystyle and missionary while I teased hubbies cock with my Hitachi. My boyfriend gave me a huge deep creampie with all of his seed and it took forever to drip out. I had to jump and down a little bit just to get some to the surface. I made my plugged and locked husband get on his knees and lick it out after I queefed a cum bubble. BF got super horny again so he fucked me a second time but I was a little nervous because the first cremate was so deep I made him pull out on my pussy but he made sure to rub it in. I was getting fucked so hard the buttplug flew out. Afterwards I put on my strap on harness and p3gged my husband to give him an orgasm denial in his cage. I love creampie play while hubby is locked. It was extra torturous that he didn't get to reclaim me at all. CREATORS: None,
128,"Sep 30, 2023","Here is Part 1 of the highlights from my recent cuckold live stream where I humiliate hubby in front of 10,000 live viewers. As the virtual cucks pay their tax to me and unlock different things I slowly begin to humiliate my husband more and more. First I rub my boyfriends feet, suck his big cock while riding hubbies face, and compare his little dick against this monster. I wanted to lock him in chastity forever but he was too hard watching me so I made him go get a bag of ice so we could shrivel his dick and balls before his cage went on. I danced and grinned on my boyfriend in front of him to build some energy and tease him before riding his cock. Part 2 is coming soon with lots of sex. You can thank one of the virtual cucks that paid for the live show and sponsored it for all of you to see <3 I'm wondering if I should stream more, what do you think? CREATORS:",
129,"Oct 3, 2023","It was the end of the night and I had showered, got on my robe, and put on my favorite silky pajamas and was getting ready for bed. I always get really horny before bed and a strong orgasm usually puts me right to sleep. My husband and boyfriend came in the room and I started to suck his BBC while my husband rubbed my pussy and held me while I rubbed his back. I started to ride his cock and hubby jerked off while watching. Before going into doggy I wanted to ride hubby but we could only go for 30 seconds or so because he was going to cum too fast so I got off and went back to fuking my boyfriend doggy style with the Hitachi wand. I then started to get spit roasted as I took his average cock in my mouth and got penetrated deep. I pulled out the love pillow for missionary so I could take it extra deep at angle and hubby started to chohke me out while we told each other how much we love another right after saying I love big black cock. I started to have a leg shaking orgasm and hubby was supposed to reclaim me after my boyfriend came but something happened and he came all over his t shirt prematurely before my boyfriend even finished. He came all over my pussy and I rubbed it in and we all had the best sleep together ever! I love threesomes with my two men. CREATORS:",
130,"Oct 7, 2023","@hot2malii and I got a massage table and began to trade massages back and forth as foreplay focusing on a Yoni & Lingam & Feet. I derobed and stroked his big beautiful black cock and then he teased my clitoris. I was beginning to cream before even penetration. He fucked me deep while I creamed all over him and I had a massive orgasm which sent me into complete bliss and relaxation. Hubby didn't get a massage, but he was allowed to reclaim me with cream as lube. I didn't let him cum on me, instead after his 60 seconds were over he had to pull out and cum in his hand as I only wanted my boyfriends cum to glisten all over my oiled body. CREATORS:",
132,"Oct 15, 2023","Last year when I hosted my first ever 8 person orgy, we all spent a day hanging out the night before. We were watching a movie in the theatre room and I started to get horny so I began to stroke @hot2malii and @louisfarel while hubby was distracted by the movie. We quickly turned off the movie and it became a suck and fuck fest before getting cum sprayed all over my face. Movie nights in with friends make such good memories <3 **CLICK HERE TO WATCH** https://onlyfans.com/770492955/neversatisfiedxo CREATORS: @louisfarel",LOUIS FAREL
133,"Oct 19, 2023",my submissive chastity wanted to go around another so I locked him up and humiliated his small cock along with my husbands while I sucked my bulls big black cock in front of them. I then made him take my panties off and warm my pussy up so I could fit that massive cock in easily. I rode him while he had to watch from a. distance. We went onto the bed and he laid there.. eyes gazed on me taking this big dick before I made him worship my body while I came. After my bull pulled out all over me he started rubbing his head against my ass while I came with my vibrator. The little cuck then had to worship my used person for until I came again. What a lucky lucky boy. CREATORS:,
134,"Oct 23, 2023","It's been a while since I've posted a FemDom Pegging video. This high roller sub had a secret dark side to him. Whether he'd be up or down, he'd always blow his winnings on me to fuck him like a little bitch in his suite. I'd put him on his knees, use him as a stool, make him suck my black cock strap on while leashed and fuck him bent over in every position like the bad little boy he is. He always calls me mommy. I'm a strict a mommy. He always begs to eat his own cum. But that's too generous to let him do that. I know he has an addiction to it. After repeatedly hitting his prostate and putting him in a completely submissive state he jerked off on his clear glass table and I used his credit card to put the cum into thick lines. I made him snort all of the cum through his left and right nostrils to go through his sinuses and give him post nasal creamy cum drip. He's addicted to Cum(Caine). The biggest high you can get. CREATORS:",
135,"Oct 25, 2023",HAPPY SPOOK SEASON! Can't wait to dress like a little slut all weekend and through next week for halloween. What are you going as? What's your biggest phobia? Your worst nightmare? My husband's is being locked in chastity for eternity and watching me get fucked multiple times a day. Or maybe... that's his wet dream. For Halloween I fucked the Black Panther's Big Thick Black. Cock at a halloween party. Hubby had to wear chastity under his costume. Darkness definetly came upon me.. and all over my ass too. Enjoy this dirty talk slay fest. <3 CREATORS:,
136,"Oct 30, 2023",It's fascinating to reflect back on how quickly it goes from meeting your first bull... seeing someone a few times a month... having a regular boyfriend and then consistently getting spit roasted by multiple men in front of my husband. It's addicting and I keep wanting to push the limits. I stroked these two studs @mrthiccbcbc and @hot2malii and went back and forth sucking their cocks before trying doggystyle. I was a little too tight still so we switched positions and I rode them before going back into doggystyle. After @hot2malii came all over my pussy I rode @mrthiccbcbc on the couch while hubby jerked his little dick before I get picked up and pounded and thrown on the bed. After I had two loads over me. Hubby was rewarded for being a good boy with reclaiming me but he had to hold onto me smearing my bulls cum all over my stomach as his grip tape. Poor thing only last a minute or so. CREATORS: @mrthiccbcbc,MRTHICCBBC
137,"Nov 5, 2023",here's a new free video <3 **Click here to watch** https://onlyfans.com/797072844/neversatisfiedxo CREATORS:,
138,"Nov 7, 2023","Every cuck loves the idea of sloppy seconds.. but that's not humiliating enough if you have a tiny dick. You get sloppy thirds. Last in line! But I'm not going to even allow you to cum at the end. You get right to the edge and denied. I told hubby to get on his knees, subservient, looking up at the massive cocks of @hot2malii and @louisfarel as I stroked them. I made him stand next to them to see how really pathetic he is in reference to a real cock. I then get fucken doggy, missionary, doggy, cowgirl, more missionary before finally taking BBC seed all over my pussy. BWC then fucks me with it and finally once I'm all stretched out its hubbies turn. But right when he's going to cum... I make him to stop. Talk about blue balls. CREATORS: @louisfarel",LOUIS FAREL
139,"Nov 22, 2023","I always get so lucky having hotwife friends who live nearby. @jessirae and I used to live like 10-15 minutes from each other and we'd always hang, have dinner, watch the fights and do fun couple stuff. She's a huge slut and a size queen like me so we had a lot of fun last year sharing big dicks together after her prgnancy. She always used condoms though. I finally convinced her to go raw.. not only with one big black cock but with three big black cocks. Lust is one hell of a drug. @chrishasabig @hot2malii @realtalk88 After we yanked the condoms off we both got absolutely stuffed like turkeys in front of our husbands. They are close friends in real life so it's fun they get to have this hobby together.. being cucked. I love playing with Jessi. Good thing we got fucked 3 days in a row and and we are planning to share some big dick more for Christmas. I love presents ;) CREATORS: @jessirae, @chrishasabig, @realtalk88","JESSI RAE, CHRISHASABIG, 88ONFLEEK"
