video_number,date,extracted_text,creators
1,"Nov 7, 2020","I promised you guys for a while now that I would fuck my first black guy and it finally happened. Hope you guys enjoy the video of me with a bbc <3 it's over 17 minutes in multiple positions filmed by my boyfriend in high resolution. we met him online and chatted for a little and FaceTimed to verify. We ended up booking a really nice 4 star hotel. We hung out for a while and had drinks and smoked some weed. We went to a strip club where everyone could tell I was flirting with him while my boyfriend sat next to me. It was pretty hot. After a few drinks I pulled it out and it was so fucking big. He fucked me for about an hour and then my boyfriend fucked me without a condom and came on me while I sucked his cock with cum dripping down my ass. He texted my boyfriend after and said ""you have a hot girlfriend I'd gladly fuck her anytime"". We dirty talk a lot about it during sex and have masturbated to this video a bunch. I've already planned another for Monday! Hopefully this new guy becomes a regular because his cock is HUGE and super fit. Already wet and touching myself thinking about it. CREATORS:",
2,"Dec 2, 2020","finally filmed with the black bull I've been talking about. He is from Africa and recently moved to the U.S. and was a professional soccer player. Hands down the biggest dick I've ever taken. We got a hotel room in the middle of the day and fucked while people in an office building could watch through the windows. I'm not on birth control so I always have had my bulls wear a condom but I really wanted to feel him bare so I let him fuck me raw and use the pull out method. The videos 16 minutes and it includes a short shower scene of us as well as multiple positions throughout the hotel room. I'm excited to film more with him. My boyfriend couldn't help but jack off while we were editing it together thats how hot is is. I appreciate all your support so far on this journey. The video purchases help me book travel, hotels, and sexy outfits as well as make the highest quality content for you. <3 CREATORS:",
3,"Dec 20, 2020","I met my bbc bull at an upscale hotel in downtown Friday night. We got a King Suite with a deep tub jacuzzi. Some info on the 18 minute video... I was blowing my boyfriend in the mirror and I didn't know that my bull was at the hotel yet. He covered my eyes and walked me into the living room and his black cock had a Santa hat and bow on it. So thoughtful haha. I'm dressed in a really sexy green lingerie with white thigh highs. I blew him for a while and we pretty much fucked in every position around the room. There's a lot of cuckold in this with dirty talk and POV of my boyfriend jerking off while I'm getting fucked really hard and even a second camera angle of him filming. We didn't use a condom at all this video and went completely bare and raw. He pulled out and came on my socks. My boyfriend got sloppy seconds and lasted only a minute and came all over my chest. I just wanted to say you have been so amazingly supportive of me this year and I really appreciate you taking the time to subscribe, talk with me, share your fantasies, and helping with donations and gifts. We've already got sooo many hot videos and bulls lined up in the new year I can't wait to share with you guys. Merry chrstmas and happy holidays. CREATORS:",
5,"Dec 31, 2020","happy holidays! I had an awesome time on my trip to Los Angeles. We spent Christmas together with family and seeing friends. Of course I had to make a little pit stop and visit a bull along the way. I had been seeing a bunch of posts on Reddit about a fit and hung bull named HungInLA who fucks all of the hottest wives. We had been trying to get him to come out to visit us but our schedules never aligned. Alas we blocked out two days with him and snuck away from family and stayed in an AirBnB in the Hollywood Hills. He ended up fucking me all morning in this video and I came multiple times and it was some of the best sex I've ever had. He fucked me in every position and filled my tight pussy up while my boyfriend watched, filmed, and jerked his cock. I made him clean my bulls cum off of me with a rag at the end and there was so much dirty talk while I came riding him. Hope you guys enjoy <3 xoxox CREATORS:",
6,"Jan 8, 2021",This is my first bbc of the new year so we thought we'd do something fun. We went on a little day trip with our bull to the lake. We took the Tesla and picked him up from his house and had some good conversation along the way. We all got super horny so decided to find a parking lot along the highway. There was a UPS truck on his lunch break so we waited it out for about 10 minutes but then we noticed there was tint on the windows so we decided to start hooking up ! there wasn't much room in the car so many boy friend had to stand outside. It was like 45 degrees and started raining halfway through. He was a trooper though and made sure to get every second of me fucking my bulls big black cock for you guys. At the end I made my boyfriend clean up my bulls cum with his beanie after I licked it up because we didn't have any towels and I didn't want to get the new car dirty. I let my boyfriend reclaim me outside of the car in the parking lot while cars were passing by on the highway and my bull filmed us. It was super hot. We ended up driving home together but it was a long drive and I was in the back seat with my bull and I could feel his cock get hard again and he started touching me and my pussy got soooo wet. I didn't plan on fucking him again but things just happened. My boyfriend was stuck focusing his eyes on the road and I could hear him jerking off. There's a ton of dirty talk and I filmed him cumming with me talking about my bull in his ear at a red light while a bunch of cars were around us haha. I ended up getting super wet again and fucked me bull one last time before we dropped him off. I decided to take the risk and not use a condom this time! Hope you enjoy this video. I think we are meeting up with a bull again Sunday for some hot content. Let me know what you think :) CREATORS:,
8,"Jan 15, 2021","the last time I met with my bull in a nice upscale downtown hotel. I was so wet getting ready the entire time and made sure to get my nails, hair, and make up done perfectly for when he arrived. I gave my bull a little oil massage and he ate me out for so long because he wanted to make sure his big cock fit inside me easier this time ;) we started off using a condom but after a minute or so I looked up at my boyfriend and we both said fuck it and I took it off because it feels so much better. I rode his cock (my favorite position) for a really long time and my boyfriend started licking my ass while I was getting fucked. that was so hot and felt so good. he pulled out on my ass and when he went to wipe it up I told to sit back and relax while my boyfriend cleaned it up instead. my boyfriend ended up handing him the camera and he filmed my bf reclaiming me but it only lasted for like a minute :( before he had to pull out and cum all over my stomach. not too sad about it though because my bull fucked me again right after (almost done editing that one!) and I came again. I'm going to start sending out more full length free videos every month to your inbox as a thank you for resubscribing. I've been very inspired and horny lately so expect to see a ton more content coming up!",
9,"Jan 23, 2021","it's annoying covid has shut down all the spas and bars in the area. I really wanted to go out on the town after I got fucked. oh well. We've been using the pull out method but a lot of people reached out with concern and I decided it'd be in my best interest to get a pregnancy test before my bull came over. my boyfriend was pretty nervous because him and I don't use condoms either. the results came back and I wasn't pregnant. my bull was about to arrive in 5-10 minutes and I wanted to finish my wine so I started stroking my boyfriend in the mirror with some dirty talk and he started leaking pre-cum and he got my pussy ready by rubbing my clit. I got really wet hearing about how much you guys liked the last size comparison so I decided to bring my tape measure this time and surprise my bull. he was 8 inches soft. my boyfriend is like 2 soft. my bull fucked me super hard in a ton of different positions. I came sooooo hard at one point and had a whole body orgasm. I was on the brink, but as soon as my boyfriend started talking to me I climaxed. my bull pulled out and came all over my ass. we only had an hour or so to get together since it was middle of the week during work. im thinking about seeing him again this weekend. CREATORS:",
10,"Jan 19, 2021",fucking my bull in the mirror in the hotel we booked for the night. I take out both my bulls cock and my boyfriends cock and compare them to one another. It really puts into perspective just how big he is. Im def a size queen haha. This vids 20 minutes long and has a bunch of my boyfriends jerking off to me getting fucked by his bbc. My boyfriend bends me over and spit roast me while I suck his cock and my bull pulls out and finishes on me in the bathroom. this was so fun. I think im going to start fucking in the mirror more often! lots of new vids being edited right now CREATORS:,
11,"Feb 7, 2021","it's my first ever cream pie! a little back story... we got super turned on by all the comments and private messages saying that you guys wanted to see me get creampied by a bbc and its honestly been one of my biggest fantasies. I just haven't really been able to do it because I don't want to deal with the hormonal changes of birth control. my boyfriend and I fantasized about it a lot but then we started talking about if we should actually do it. our mutual consensus was it was too early since we just started a few months ago. that kind of all fell through though when we met up with my bull on Monday because it lined up perfectly with my cycle and falling on the day I was least likely going to get pregnant according to this app I have on my iPhone that tracks it since we have been going barebak . I talked with my boyfriend about it and said if things felt natural we would go ahead and just do it and figure it out afterwards. so... here's my first ever cream pie! its also my longest video at around 40 minutes and includes a lot of spanking, mfm, dirty talk, (I called my bull daddy for the first time.. omg) , and of course a super messy cream pie. he came super deep in me and we were trying to get it out with fingers and pushing it out for a few minutes but finally I queefed because he was fucking me for so long and it came out all over my pussy and thighs.. hope you guys enjoy! I honestly don't know if I'll ever do this again just because it was super risky. <3 CREATORS: None",
13,"Mar 3, 2021", ive been cucking my boyfriend a lot lately. it's been really hot to have him more involved while im fucking my bull. he was fucking me deep from behind while I had the magic wand on my clit. my boyfriend was hugging me and holding me while I was cumming it was so amazing to connect like that with the two of them. my bull pulled out and came all over my back and ass. I mounted my boyfriend and starting riding him to reclaim my pussy. my bf came so fast while spreading my ass with my bulls mess all over it. it was so hot to think both of their cum was dripping down my back together. Let me know what you think!! I can't wait to do this again. CREATORS:,
14,"Mar 15, 2021","I locked my boyfriend in chastity and gave my bbc bull the key. ive been fantasizing about taking two bbcs a lot lately but haven't been able to find a bull in my area that is big enough to satisfy me. luckily ive been talking to a few guys online that I'm going to travel to soon ;) in the meantime, I made my boyfriend hold a black dildo over his locked cock so I could ride a bigger cock then his and fantasize about it being someone else. I came so many times all over my bulls cock while my boyfriend choked me and slapped my ass. this is the first time I kept my boyfriend caged the entire time and he didn't get to fuck me or reclaim me after. he was soooo frustrated. I teased his locked up cock with a wand and made him wait. my bull and I were laughing lol. hope you enjoy xoxox let me know once you've watched how it was <3 CREATORS:",
15,"Apr 8, 2021",wow. it been so amazing to have my bull creampie me deeper and deeper each time. we took a weekend trip to our vacation home together for a weekend with my bull and he bent me over the kitchen table after I had a few glasses of wine and I sucked his big black cock while leashed and on my knees. we moved all over the house and fucked in the guest room and finally the master. we didn't plan for a creampie but during the middle of sex I just got too horny and turned on and told him to cum in me. he came all the way in me and slowly pulled his cock out and he started to finger it out of me. I told my boyfriend to come over and clean it out of me... it was our first time doing a creampie clean up in my pussy but I held his head against my pussy so he could lick up every last drop.. he was gasping for air haha. I let my boyfriend then fuck and reclaim me .. but my bull placed his big cock in front of him as a constant reminder of the size difference while we were in doggystyle. I made my boyfriend pull out and cum on my back instead of cumming in me. it was already risky enough with one cream pie. I hope you guys enjoy this video. I have a new bull flying in next week for some fun... and ive had a lot of new bulls reach out to me lately that so im gonna be traveling a bit! ive also been befriending a few different sexy hotwives that I can't wait to play with and share videos with. love you !!! have a good day. CREATORS:,
16,"Apr 21, 2021",I love being outdoors and I love to fuck and be naughty in public places. I went down to the nude beach this last weekend with my boyfriend and invited my bull to come along ;) . We got there on a Saturday mid day at the busiest time and the parking lot was packed. We went down to the water and followed a trail along to get some privacy and ended up settling on a little cove. The only issue was it was right off the main trailer and anyone could peak over and see. That didn't stop me because I was so horny. This was the first time I've ever cucked my boyfriend out in public.. let alone with so many people. I started sucking his BBC and riding him and we had to stop a few times because people were coming. We fucked a good twenty minutes or so and we had a few people watching from up above. My boyfriend had to be stealthy with the camera. I came really hard knowing that Iw as putting on a show for people. It started to get so busy that my bull led me into the bushes right off the trail and he fucked me doggystyle while my boyfriend jerked off. A couple people followed us and we could see them watching through the bushes. My boyfriend fucked me and reclaimed me while our audience watched and he came all over my back. What a hot day. I can't wait to fuck more BBC outdoors all summer long. I'm going to Vegas this weekend to see a few bulls and film some of my dirtiest videos yet! CREATORS:,
17,"May 4, 2021"," I just got back from an entire week of getting fucked by a new bbc bull! I flew to Las Vegas with my boyfriend for a week of dirty fun. I saw this well known hung bull off reddit ""areallyweakguy"". We ended up having a three-some, fucking in hotels, houses, in the mountains, and he even flew to see me again afterwards in my area. We were fucking multiple times a day for a week. This video is of the first time I've ever had a bull sleep over in the same house as us.. and you know what that means.. I got fucked in front of my boyfriend at all hours of the day a night. I even told him how much I wish I was on birth control so I could take his cum inside of me. This is from Night 2. We fucked in so many positions throughout the jacuzzi, house, and bedrooms. I'm off to fly to Denver tomorrow to see a new BBC bull for the weekend. stay tuned for updates! CREATORS:",
18,"May 24, 2021"," had been talking to a new bull online for a few months and he had a huge cock and was really turned on with every message he sent. he was traveling to a state near us so we decided to take off work and book some flights to visit him. we stayed in a nice suite. this video is from our final night together. he came over around 9pm and we had a few drinks. we went to the strip club and my boyfriend called us an uber, paid to cut the line, and gave us cash for the strippers ;) . He had been locked in chastity the whole trip and I didn't want to let him out of it yet and it was hot knowing we were in a crowded place and I was dancing and flirting with my bull while my boyfriend was locked up watching and no one knew. We went back to the hotel around 1 AM and fucked til 4 in the morning. My boyfriend was rubbing me all over while I was cumming on his big cock. We had an early morning flight the next morning. We planned to let my boyfriend finally reclaim me but I forgot to let him out and it was late so he had to wait til we got home. I have a few more videos from this weekend I can't wait to share. I'll be meeting with him again in June with another really sexy hotwife for some 3some funnnn. CREATORS:",
19,"May 21, 2021",first night meeting with a new bull @thefirstclassjd . He flew in for a weekend of fun.. After he got off the plane and we picked him up we went for drinks to one of our local neighborhood bars to get to know him a little better and loosen up. We instantly had a connection. I started to sit next to him and flirt with him in front of my boyfriend and the whole restaurant. We walked down to the marina to the docks .. it was so romantic out as it was becoming sunset. After holding hands we went back to the house and started to party. I pulled out his big black cock after grinding with him and we moved instantly to the living room where I sucked his cock. He fucked me so deep in doggy style and tied my hands behind my back. I told him he could creampie deep in my pussy. He pumped every last drop of his load in me and I spread my pussy wide for my boyfriend to stare it. I could tell he was so turned on that I told him I wanted him to fuck me right away while his cum was still inside me. It was sooo hot to fuck him right after a creampie. We ended up doing it all weekend. hope you enjoy the video <3 xoxoxo CREATORS: @thefirstclassjd,FIRSTCLASSJD
20,"Jun 3, 2021",after having a sexcapade with @areallyweakguy in Las Vegas he visited me in my hometown. We stayed in our family lakehouse and fucked all over ... down by the water.. the patio... and in the house (more of this to come!) . @emmariley and her long distance hubby were up to some naughty adventures so I invited her over to have a FFM threesome! Both our cuck hubbies got to watch us take his huge dick and fuck us in everyone position. It was sooo hot rubbing Emma's tight little ass-hole while her pussy was being stretched and seeing the smile on our men's faces as they stroked their cocks and video taped us. We had a reclaiming party later that night where they both got to try and take our pussies back after being stretched while we gave our bull a double mouthed blowjob... can't wait to finish editing and sharing that with you soon!!! CREATORS: @areallyweakguy,AREALLYWEAKGUY
21,"Jun 17, 2021",biggest bbc bull i've had yet! i flew out to see him after talking for weeks. he came over during the middle of the day and we fucked all over the room with the blinds wide open for the city to see his thick black cock filled my tight pussy up and the contrast of his skin on mine made me dripping wet. we ended up fucking for hours this day and hung out through the entire weekend. we took a shower together (next video) and my boyfriend and i had the most amazing sex afterwards the rest of the day. CREATORS:,
22,"Jun 24, 2021","I was able to be apart of another hotwife's first big black cock experiences. I was introduced to @water_melonsugar3 through my bull Poppichulo34. He was going to visit her and invited me a long on the trip. It was her first experience going black. We flirted on FaceTime and Instagram for a few weeks and we had an instant connection. My hubby and I flew into her hometown and rented an AirBnB for some summer fun. We ended up getting drinks and having some nice conversation and picking up a bottle of tequila at the liquor store. after a few shots we went down to the beach and started making out and fucking on the sand. She was so excited and nervous for her first black cock! We ended up having the hottest 3some. I got to rub her clit as she took him all the way deep and it felt so amazing having her hands rub all over my body as I bounced up and down. I was surprised she was able to take all of him and I was too turned on hearing how dripping wet her pussy was. Both of our cuck hubbies got to watch, film, and jerk off. This is one of my longest video at 52 minutes. Part 2 of our second night together where our hubbies reclaimed us after we got stretched by bbc coming very soon! CREATORS: @water_melonsugar3",HOTWIFE JENNY
23,"Jul 5, 2021",I met @dirtymoana online and we had been flirting back and forth for what felt like forever! she was going to be in Vegas around the same time I was for some of her BBC sexcapades (she really is the dirtiest hotwife out there ;) . Her husband my partner and I grabbed drinks the first night and I was getting so wet thinking about having sex with her all night long !! she introduced me to @areallyweakguy and we had the hottesttt 3some with both of our hubbies watching and filming in the corner. Her and I made love all night long. So much passion in her lips and when she went down on me she treated me like a queen!!! I loved rubbing my clit while she got pounded super rough. My partner and I watch her videos all the time so it was a dream come true to see her in her element taking big black cock!!! she has invited me to a crazy swingers island in Europe for a bbc gang bang. Should I go !??!? I need someone to sponsor me with a first class flight hahah ;p CREATORS: @areallyweakguy,AREALLYWEAKGUY
24,"Jul 8, 2021",I get a deep BBC creampie and my boyfriend gets sloppy seconds and creampies me right after*** happy Thursday !! yesterday was my birthday ;) here's my newest video. @thefirstclassjd flew out to fuck me and cuck my boyfriend! we fucked in the front yard near our shed while my boyfriend jerked off and held my body. I love being consumed by his touch while I take big cock. We then went inside and fucked raw all over the house. JD creampied me so deep while my boyfriend watched and jerked off. I then let him go in for sloppy seconds and give me a double creampie!! it was so wet and creamy. I really need one of you guys to come clean this up. CREATORS: @thefirstclassjd,FIRSTCLASSJD
25,"Jul 19, 2021","this is part 2 of the lakehouse BBC FFM threesome where me and @emmariley cuckold both our hubbies with a @reallyweakguy. in this video they both their chance to reclaim our pussies while we sucked @areallyweakguy huge cock. they jerked their dicks right next to each other while they got to watch us. we could barely feel them the whole time but it only felt right for them to have their chance to reconnect with us. we then had same room sex while our bull filmed us. they came sooo prematurely and fast! wow we can't wait to cuck them together more when we plan some future vacations together. this is why I love hotwife friends!!!! CREATORS: @reallyweakguy, @areallyweakguy",AREALLYWEAKGUY
26,"Aug 13, 2021","I was on a few week long road trip traveling to Los Angeles. We first ended up stopping at a sex club in San Francisco and I had two girls on my arm the whole night. We played in the orgy and everyone got to watch me and my boyfriend fuck! There was this really cute couple next to us that was having sex as well and the girl and I were kissing while riding our men. It was so hot all four us came at the same time. We are starting to love group play so much more!! Anyways - we got to Los Angeles and stayed at this amazingly beautiful Suite in West Hollywood. I was down at the pool in this tight bikini thong and I was getting so wet knowing everyone was staring at my ass. I had been flirting with a new bbc bull on reddit who drove out to come see. My boyfriend and I had been fantasizing about him fucking me the whole road trip. We got to my hotel room and he had such an amazing personality, fit body, and huge cock. We started kissing and making out and he even taught me to dance since he was a professional dancer ! I sucked his cock good and he ate me out in 69. He was fucking me in every position and had the best stamina.. on the couch.. the bed.. and up agains the window for the whole city to see me. My boyfriend was stroking his dick the whole time and I started sucking him off. He began fingering my ass as I jerked him off and I rode his big cock. When I was getting fucked doggy he started rubbing my feet and it made me cum sooo hard. Finally he fucked me on the bed face down and came all over my face with a big facial! We had such a fun time and already planning another trip to go see him. I'm also waiting eagerly for my regular bull to come visit and stay with me next week. Enjoy!!!! More videos going soon !!! CREATORS:",
