video_number,date,extracted_text,creators
56,"Apr 22, 2022","many of you have been requesting more of my feet worshipping big black cocks after ive gotten a pedicure! this is the first night together with @tribalbbc in Atlanta when I went to go m33t @missvsp in video #40 the next day where we both cucked our hubbies in chastity. @tribalbbc came to our hotel before we went out and fucked me up against the window in front of the Atlanta falcons football stadium. I have a huge fantasy to get gang banged by an NFL or NBA team so I was just imaging they all spotting me during practice and coming over to fuck me at the same time. He cums multiple times in this video riding me, and then I jerk off his big cock with my feet . He loved it and then after fucking me again missionary he pulled out and came all over my pretty little toes. Hope you enjoy. Let me know if you like feet content <3 CREATORS: @tribalbbc, @missvsp","TRIBALBBC, MISSVSP"
57,"May 1, 2022","redhead hotwife friend @jessirae some of my recent photos of me sharing @louisfarel and @hot2malii big cocks in double vaginal penetration with anotherr hotwife. she told me that her and her husband had the fantasy of getting her pussy filled with two cocks at the same time while she sucked his dick! I told her that could easily be arranged. we hung out for a bit in their living room and we both got pretty horny and started to kiss. the bulls came in and we sucked their big cocks side by side stroking them up and down before we began riding them as our hubbies watched and filmed. Jessi was feeling extra wet so she wanted to get stuffed in her pussy first. I started to rim my bulls ass while he was pounding her and it was like a human train of ecstasy. I wanted my turn next and took both their big cocks in pussy. Jessi's husband started to throat fuck me. My hubby was the only one not included as he was made to film it all. Jessi laid back and I started to eat her pussy as all three guys jerked off and came on her face <3 this ones sooo hot. CREATORS: @jessirae, @louisfarel","JESSI RAE, LOUIS FAREL"
58,"May 11, 2022","After watching her take two big BWC & BBCs in her tight pussy and watching her legs shake in orgasm, I got inspired and turned on at the thought of trying it myself the next night. we started riding and fucking @louisfarel and @hot2malii while our hubbies filmed and watched. She had a buttplug in with a tail that made her feel full and sent quakes of pleasure throughout her body. After we got fucked side by side and I rubbed her clit to orgasm, it was time for me to finally try two bull cocks in me. @saylervixen helped guide and slide them in and rubbed my body for reassurance. I loved every second of it, and I can truly say I'm addicted to getting two cocks in me at one time. I've never felt so full. I'm going to do it a lot more. @louisfarel then came on my ass and @hotm2alii came on her face. We kissed and showered together after to clean our dirty little selves off! hope you enjoy this one <3 CREATORS: @saylervixen, @louisfarel","SAYLER VIXEN, LOUIS FAREL"
60,"May 27, 2022","hubby's family is in town but I still managed to go fuck my bull for a quickie when I told them I was going to run out and do some errands lol. anyways ! here's my newest video with @mulberry212 :) we've been chatting online for a while and talking about how much she loves BBC and cucking her hubby. we had such similar interests and we fantasized about sharing a dick together. she had a weekend open where she could m33t me without her hubby. we looked so cute together in our matching QoS tattoos. We both told hubby that it was time to wear his cage and we passed they key off between eachohter. I officially anointed her as a key holder of his. She held onto it while she was getting hammered and I loved to hear the way she humiliated hubby while we were both getting fucked. She said she had lost the key and hubbys heart sank but she was just joking with him to torment him a little bit. Not in Chasity, it's hard to get hubby to come clean up my bulls cum off my pussy but after being locked up and put in his place for a while, I got him into a subservient state and he was willing to do anything I told him to with the prospect of being let free and releasing himself being on the table. After he cleaned me up I told him he was a good boy but still felt it was right to keep him caged. So much fun. Mulberry went home to her hubby for some reclaiming sex and texted me she was still fantasizing about my bulls huge cock. can't wait til we can fuck her hubby together in person! CREATORS: @mulberry212",MULBERRY
61,"Jun 6, 2022"," For all the OG subscribers who have been here for a while, you'll remember my bff @emmariley had let me know about her BBC fantasy and I was honored to share my bull with her for her first time! from there she hooked and we cucked her long distance boyfriend together and even cucked him in person when he would come to visit her. sadly life happened, and Emma had to move away and step away from hotwifing for a while, while she focused on building her new life in a new town. after almost a year break, she messaged me one night telling me how often she fantasized about all the fun we had together fucking big cocks. I told her she should come visit even though it was far. She said she'd love to as she was starting to get tired of just fucking her hubby and wasn't able to find any big cocks in her area. She left him at home, and came to stay with me for a few days! I told her how submissive of a cuck hubby has been and she wanted to make fun of him in chastity with me in front of my bull. We humiliated him so much - its so hot hearing how demeaning she was. Emma has always used condoms to prevent any pregnancy risk if you've seen any of our previous videos together, and I was super surprised when she told me she wanted to go bearback after just a few minutes of fucking my bull with a condom on. I'm not sure what overcame her, but I guess we'll just call it lust. It was sooooo amazing to see her take all of his big cock raw. We fucked in so many positions and then he finally pulled out and came all over her pussy before I licked it up. Hubby asked if he could reclaim me but I told him to jerk off in his cage and denied him. Let me know how you enjoyed this one. Emma is going to start hanging out with me more as I introduce her to more and more hung guys. Her hubby is going to see this at the same time as you ;) CREATORS: @emmariley",EMMARILEY
62,"Jun 13, 2022","I met the amazingly sexy @emmas_secretlife for the first time after we had been messaging back and forth online. she and her hubby were a cute couple just getting more and more into the hotwife lifestyle. my friend @tribalbbc was going to be in town and we all arranged to get together after going clubbing at a pool party and having a few drinks together. we got into the hotel room and started blasting music and we instantly starting taking off his pants as both our hubbies watched and filmed us. it was such hot, rough, sex, and we both came over and over again. this was the first day of our weekend hanging out and then we ended up getting back to back MFFM BBC 4somes in a house we all stayed in together <3 CREATORS: @tribalbbc",TRIBALBBC
63,"Jun 20, 2022"," loved how she dommed and cucked her boyfriend and I loved watching her videos. we found some time to m33t up not too long ago and she came to visit me for a whole week! we got drinks the first night together and talked about our relationships and the lifestyle we live. we all instantly connected! the next night, I wanted to introduce her to my bull @hot2malii and he came over to her hotel and she was sooo wet thinking about taking her first BBC. her boyfriend was locked in the cutest little pink chastity cage with a heart lock. It didn't take time for everyone to fall into their natural pecking order and we started to humiliate her and my hubbies tiny little cocks while we stroked his. aurora was so dominant with her boyfriend.. she told him how small his dick was and started to inflict some pain on his locked up balls. I started riding @hot2malii to show aurora how to handle such a big thick cock. as soon as its was her turn, it slid so easily in. I started to f0rce her boyfriends face into her pussy as he watched helplessly as she got fucked by a stronger man. I pulled his leash tighter and started walking him around the room on all fours. He had to look at the floor until I briefly let him get a look at her getting on his big cock. After using the Hitachi wands on our pussies we both came super hard and @hotm2alii pulled out all over my stomach. Aurora and I walked her boyfriend over on a leash and made him clean up every single ounce of cum. I'd say it was a great first night hanging together. We have sooo many amazing videos already together and already trying to plan another trip soon this summer <3 CREATORS: @aurora_aspen",AURORA ASPEN
64,"Jul 2, 2022","@emmariley and I rubbed my hubbies cock up against my bull @louisfarel with oil and gave them a double barrel handjob and blow. it was my hubbies first time ever having male to male contact after we fantasized about it for a while. his cock was so much smaller then my bull's when I had them both in my hand... I kept slipping off hubbies lol. we went back and forth talking about the size. afterwards my bbc bull @hotm2alii came in and I started sucking his big black cock while Emma stroked their cocks together. I then took out my tape measure and hubby came in at 2.5 inches soft. omg. Emma and I both then took @louisfarel and @hot2malii s big cocks in every position while hubby watched. I started rubbing Emma's ass in doggy til she came. Hubby then had to reclaim my pussy by having sex with me - but he didn't last very long. He got a special treat and licked Emma's pusssy while she rode his face. I'd say he lasted 1 minute total? Maybe less. He basically got double stuffed by used bull pussy! We laughed about it and I needed to come again so I used my Hitachi wand until my legs were shaking. while @hot2malii jerked off his big dick and came all over my stomache. we both came at the same time! I told hubby to put down the camera and come clean it all up. mmmm! this is the first time we've tried frottage. let me know if you want to see us explore this more together <3 CREATORS: @louisfarel, @hotm2alii","LOUIS FAREL, HOTM2ALII"
66,"Jul 25, 2022","we wanted to get to the bottom of whose cuck had the smallest dick in comparison to the bulls we both were about to fuck. we were all playing pool so we lined them up with their dicks flopped out on the pool tables (everyone but my hubby reached it , he didn't even touch the ledge). We grabbed some pool balls and ranked them 1 to 4. Of course the BBC @hot2malii came in at #1, BWC came @louisfarel in at #2, @aurora_aspen's cuck at #3, and sadly my hubby took the L and came in last place. we kicked him out because he was useless, and then humiliated aurora's boyfriend a little more. She revealed to me that he liked some pain... specifically in his balls.. and I watched her kick him in the balls a few times in her videos so we decided to handcuff him and make him sit on the pool table naked while we both got fucked. his balls were reaching down onto the felt so we took some pool sticks, loaded them back, and started firing away. he was groaning... I'm not sure if it was in ecstasy or in pain .. probably both. Once we started getting fucked super hard, we ditched the pool sticks and just started chucking the balls as fast as we could. It was hilarious to see him flinch and wince. We pushed him on the couch and he was finally allowed to touch himself as we rode cowgirl and reverse cowgirl switching back and forth between two huge cocks. once we started worshipping them with our mouths, we told her cuck to get on the ground and smell and taste our used pussies. he was such a good little boy that after, when my bbc bull finished all over my stomach, I allowed him clean it up with his tongue. I can only imagine how salty and warm it was! But he swallowed all of it. And I think he loved it. He was then made to watch his girlfriend get really deep long strokes and a deep, thick, creampie. After it oozed out, she summoned him and he did an amazing job cleaning her up and cleaning her out. Like the good little submissive maid he is. I can't wait to inflict some pain on him again! Luckily, they are coming to stay with me all week and me and @aurora_aspen have been planning a bunch of fun activities for him as well as my hubby <3 Wait til you see the next video we are editing...","AURORA ASPEN, HOT2MALII, LOUIS FAREL"
67,"Aug 5, 2022","! my girlfriend @emmariley has been staying with me more and more lately <3 she really enjoys fucking hung guys with me. it's been such a fun time having her sleep over, tanning nude together, taking bubble baths, and going out at night to look for hung guys together. We were both super horny and wanted to get fucked so I invited my bbc bull @hot2malii over and he fucked both of us while my cuck watched. It's not enough to tease him and torment him by having him just watch me, I now like to include my friends to double the agony and put him really in his place. Emma and I took his huge black cock in a ton of different positions while he stroked his cock. She started turning into a little submissive slut for me, so I put on my strap on and started fucking her mouth with it while she got stretched really wide. I then started fucking her with the strap on while I took it doggy style. It felt amazing to have her legs wrapped around me. My bull fucked her super hard and came all over her stomach and i cleaned it up. I then sucked the remaining cum off his cock. We were still really playful and horny so we both started talking humiliatingly towards my hubby. I made him jerk off in front of us and made him rub his cock against the strap on, pretending it was a big cock, until he came all over. I REALLY wanted to humiliate him in front of Emma and my bull so I forced him to suck the cum off the strap on. Lol. I have so many more fun adventures with Emma coming up <3 Wouldn't it be hot to see us take two BBCs together??? ;) CREATORS: @emmariley, @hot2malii","EMMARILEY, HOT2MALII"
68,"Aug 14, 2022","I met a new girlfriend @emmas_secretlife and found out she was just as much of a size queen as me and loveeeeed big black cock. I knew we'd get right along. We arranged a couples trip together with her hubby and mine and we had the best time going out together. We all talked about how hot it would be for the two of us to fuck some big thick BBCs in front of our hubbies while they watched and arranged for my bull @hotm2alii and @tribalbbc to come m33t us when we went out to a nightclub that night. We ended up dancing with them in front of our hubbies in front of everyone! It was so hot to see everyone looking at us as we flirted with other guys. The guys left and invited us back to their place afterwards. My hubby was designated driver for the night so he took us over on the other side of town. they were waiting for us at the door already and we started kissing and pressing up against their huge bulges. They each led us into their own room and fucked us individually before passing off to the other, making us switch rooms, and get a feel for each of them deeply inside of us before we all joined together for the hottest foursome. Emma is such a little BBC slut we both came and got our brains fucked out. Our hubbies loved the show <3 we all hung out after and went in the jacuzzi and ended up meeting up again the next night for some more fun together <3 (coming soon). Let me know what you think!! over 1.5 hours of really hot bbc interracial hotwife footage. CREATORS: @emmas_secretlife, @hotm2alii, @tribalbbc","EMMASSECRETLIFE, @HOTM2ALII, TRIBALBBC"
69,"Aug 22, 2022","I made @aurora_aspens boyfriend dress in lingerie in the other room and locked him in chastity while @aurora_aspen started sucking off @louisfarel thick cock in the living room. I put his leash on and walked him on all fours with his head pointed towards the ground until finally I placed him into position to watch his girlfriend sucking a bigger and thicker cock in front of him. I tugged on his leash so it ch0ked him a little and slowly but surely he got the hint that he was going to not only be watching but touching and sucking a big white bull cock shortly. I made him grab onto his tree trunk cock and slowly stroke it as it went in and out of Aurora's tight little pussy. I spanked him, teased his chastity cage, pulled on his undies, and humiliated him. I'm not sure if he loved it or hated it. I'm sure deep inside of his pathetic soul he loved it. Pretty soon I didn't even have to f0rce his head onto his cock - he was just suck it and g@gging on it in between aurora getting fucked in every position. @louisfarel let out a huge cum load in and around her pussy and our little locked cuck had clean up duty and had to worship her pussy deeply and get out the cum from every corner. Afterwards we laid him on his back on the floor, and made our bull cum on his pink chastity cage and then f0rce f3d him the cum in his mouth. A double double. Let me know if you like this video and want see me f0rce more submissive guys suck on bull cocks and be feminized in chastity <3 CREATORS: @aurora_aspen, @louisfarel","AURORA ASPEN, LOUIS FAREL"
71,"Aug 29, 2022","@mulberry212 hubby flew her out to see me so we could share a big cock together. we both ended up having a fun night out and meeting @louisfarel where he fucked both us very deeply and sensually. I made hubby take off the condom off of @louisfarel cock when it was my turn to fuck him since I prefer to go bare. I ended up using the Hitachi wand on my clit while he fucked me doggystyle and mulberry suffocated me with her pussy by riding my face. I came sooo hard that I let out a long moan and my legs were uncontrollably shaking. I love orgams like that. WATCH HERE https://onlyfans.com/393595181/reallysweettea CREATORS: @mulberry212, @louisfarel","MULBERRY, LOUIS FAREL"
74,"Sep 6, 2022","I started out my relationship with hubby by pegging him frequently and uploading the videos online. the positive feedback pushed me further to make him my sub ! prostate milking, bigger and bigger strap ons, and also bbc cuckold dirty talk before we tried the real thing! we fell out of pegging a little lately as it became more focused on my pleasure as I cucked him with bigger more dominant guys and locked him in chastity. we recently have gotten really turned on by it again and I figured what better way to end the summer then to start incorporating strap on play when my bulls come over from now on! I started with locking hubby in chastity and bending him over while I used a finger to rub and massage his prostate til he loosened up. I then started fucking him sensually with my strap on. As he moaned harder .. I told @hot2malii to come in and start fucking me. We both pressed against him as my strap on went in as deep as it could and my body went flush as I adjusted to his huge thick cock stretching out my pussy. After a few minutes we were in sync and unison and we were all in our rightful places. We started sweating and I could feel the endorphins and lust. Afterwards the focus was on me as @hot2malii fucked me in different position and hubby worshipped and rubbed my body and started stroking my black strap on as I rode. We moved to doggy and I told him to come lay under me and start licking my clit while I was getting fucked since that makes me cum the hardest. When he was under me he was worshipping my pussy as each thrust went in and out and my juices dropped all over his face. When my bull pulled out, he came all over my ass and I rode hubbys face til it smeared all over his lips and mouth. I then let him try and mount me with his chastity cage after with my bulls cum dripping down my pussy and he was so frustrated that he couldn't actually penetrate me or feel my used pussy and had to hold in all of his cum while his balls swelled. I'm having so much fun doing this anytime I invite my boyfriends over. Tomorrow we are all getting together to do this again <3 two hung guys, hubby in chastity, and my strap on. I'll send some updates <3 CREATORS:",
75,"Sep 22, 2022","I'm on my way to Los Angeles to play with some friend and two BBCs at the same time. I hope you enjoy this newest video. This was earlier in the summer, @saylervixen and her hubby flew out to come hang for a orgy that I hosted (that videos coming soon). We were due to take two big black cocks together but her flight got delayed and we missed the opportunity. After the orgy, we had such a fun time, that I changed her plane ticket and invited her up to a penthouse suite to make sure it happened! We ended up getting branded with Queen of Spades tattoo and worshipped two really amazing big black cocks @tribalbbc and @hot2malii . We got fucked in every position and all around the room. Sayler was such a submissive little slut that I leashed her and collared her and choked and her as she was getting deeply penetrated. and passed back and forth. She got a creampie, and spread her pussy for her cuck as he video taped and went to rinse off in the shower and @hot2malii got his big cock hard again and fucked her while hot steamy water was running down! This is over an hour over footage and is super hot <3 let me know if you like watching me and @saylervixen get fucked today. she's so cute and sexy and loves BBC as much as I do (my type of friend!) CREATORS: @saylervixen, @tribalbbc","SAYLER VIXEN, TRIBALBBC"
76,"Oct 3, 2022",we spent the night in a cute pink dungeon with tons of BDSM props and toys to tease her submissive cuck with. We tied him to the bed and invited @hot2malii over and made him watch us fuck his huge cock while he was locked to the bed! It was so fun to humiliate him <3 After my hubby got to reclaim me while Auroras cuck stayed locked in chastity and got strap on p3gged. I can only imagine how frustrating that could be.... to be a cuck locked in chastity getting fucked in the ass while you watch another cuck reclaim a pussy free and with no cage. I guess that's just how life goes sometimes! I hope you enjoy spooky season this month and your chastity cages are locked to their tightest setting! I bet its frustrating for you to watch this without release ;) CREATORS: @aurora_aspen,AURORA ASPEN
77,"Oct 9, 2022","I dressed @louisfarelx in this cute fishnet outfit and ordered him to go out onto his balcony for everyone to see how pretty he looked. I turned him around, spanked him, and lubed his ass to get him ready for my big black strap on. I then fucked him senseless on the balcony and he begged for me to stop. After humiliating him just the right amount I threw his ass on the bed to show him who was boss and stuck it straight in his ass. We moved through every position while I made him jerk his big cock off and call me mommy. I'm working on completely shattering his ego, so I let him cum, but it had to be with his legs sprawled in their air with his tongue hanging out and jerking his pathetic cock until every last drop of his cum was swallowed. He's such a good boy. I'm just getting started with him. CREATORS: @louisfarelx",@LOUISFARELX
78,"Oct 11, 2022","During a summer vacation our hubbies lined up @hot2malii and @louisfarel to surprise us at our hotel, as they were both texting about how hot it would be to see their wives get fucked by some bulls. We were playing in bed together, and they knocked on the door, and we took off their pants and their huge cocks popped out. We started to worship them. Afterwards they moved us onto the bed and fucked us missionary, doggystyle, riding and every way you can think of. I got ch0ked and had her laying on top of me as we both got fucked. @hot2malii came on my pussy and @louis-farel came all over her ass and I sucked the cum out of his cock and licked it off her ass. We then had a little round two <3 Hope you enjoy this one <3 CREATORS: @funsize4sharing, @hot2malii, @louisfarel","KENDALL PAIGE, HOT2MALII, LOUIS FAREL"
79,"Oct 18, 2022","@emmariley and I seem to get into trouble wherever we go. As you know, we used to live right near each other - but life's forces caused us to move away to different cities. It made me so sad as she was my first lesbian experience and I got to share her first big black cock with her. We always stay in touch though, sharing our dirty fantasies and talking about our cuck hubbies, and the bulls we want to fuck together. Emma had been bored in her hometown, and her hubby had been working brutally long hours, and she felt unsatisfied sexually. I invited her out and told her she needed a girls weekend and I'd make sure to take care of that for her. We ended up inviting two BBC's over @hotm2malii and 88onfleek to come fuck us and make sure we get off and came. We hung out at our house and swam all day, and then made it to another house after grabbing some dinner. We drank a bit, flirted, and the clothes fell off. Emma was so turned on by the site of two big beautiful black cocks thats she dove right in and things just happened effortlessly from there. They pounded us, made us dripping wet, and we both got to let out screaming orgasm's which made us feel so calm and relaxed afterwards. Emma ended up coming back all summer to play with me ;) I hope you enjoy this video of the two of us - sisters for life - and we have and will be sharing many more big dicks this year <3 CREATORS:",
